,Question,Answer
0,What is a tool poisoning attack in MCP?,"A tool poisoning attack in MCP occurs when an adversary embeds malicious natural-language instructions into a tool’s description or metadata. These instructions are then loaded into the agent’s context during MCP registration, causing the agent to treat them as part of its operational instructions [ID: 3]."
1,How does tool poisoning affect AI agents in the MCP ecosystem?,"Tool poisoning affects AI agents in the MCP ecosystem by allowing an adversary to embed malicious natural-language instructions into a tool’s description or metadata. When these instructions are loaded into the agent’s context during MCP registration, the agent treats them as part of the tool specification. This can lead the agent to perform unauthorized operations, such as secret exfiltration, via otherwise legitimate tools [ID: 4]."
2,What are the security issues in MCP servers?,"Security issues in MCP servers typically arise from unsafe execution environments, weak authentication or authorization, overly permissive introspection interfaces, or inadequate isolation between tools and the underlying infrastructure [ID: 11]. Additionally, if the server-side safeguards are compromised, attacks can escalate beyond the MCP ecosystem into broader systems, highlighting the importance of robust server-side defenses [ID: 12]."
3,Explain MCP host.,I don't know.
4,What are the primary and secondary defense layers in MCP eco-system,"The primary defense layer in the Model Context Protocol (MCP) ecosystem is designed to prevent an attack from occurring in the first place or to block it at the earliest possible point of interaction with the system. It operates closest to the attack source, aiming to stop malicious inputs, behaviors, or configurations before they can influence downstream components [ID: 17].

The secondary defense layer provides defense-in-depth by limiting the impact and propagation of an attack when the primary defense layer fails, is misconfigured, or is deliberately bypassed. This layer focuses on containment, mitigation, and recovery rather than preventing the initial compromise [ID: 18]."
